<?xml version="1.0" encoding="UTF-8"?>
<!--
  ~ Copyright 2007 Philip Jones, EMBL-European Bioinformatics Institute
  ~
  ~ Licensed under the Apache License, Version 2.0 (the "License");
  ~ you may not use this file except in compliance with the License.
  ~ You may obtain a copy of the License at
  ~
  ~ http://www.apache.org/licenses/LICENSE-2.0
  ~
  ~ Unless required by applicable law or agreed to in writing, software
  ~ distributed under the License is distributed on an "AS IS" BASIS,
  ~ WITHOUT WARRANTIES OR CONDITIONS OF ANY KIND, either express or implied.
  ~ See the License for the specific language governing permissions and
  ~ limitations under the License.
  ~
  ~
  ~ For further details of the mydas project, including source code,
  ~ downloads and documentation, please see:
  ~
  ~ http://code.google.com/p/mydas/
  ~
  -->

<mydasserver xmlns:xsi="http://www.w3.org/2001/XMLSchema-instance"
 xsi:noNamespaceSchemaLocation="http://mydas.googlecode.com/svn/trunk/mydas/server_core/src/main/resources/mydasserverconfig.xsd">
    <!-- The global element holds details of configuration common to the entire server. -->
    <global>
        <!-- The URL of the DAS server up to an including /das/ (e.g. http://www.ebi.ac.uk/das-srv/uniprot/das/) -->
        <baseurl>http://www.ebi.ac.uk/das-srv/uniprot/das/</baseurl>
        <!-- A boolean switch indicating if the output from the DAS server should be compressed or not. -->
        <gzipped>true</gzipped>
        <!-- The name of the default DAS stylesheet to be used for all of the defined datasources.
        This can be overridden for individual datasources by including a stylesheet element for them. -->
        <default-stylesheet>mydasStyle.style</default-stylesheet>
        <!-- These global properties are made available to all the plugin classes
        through the DataSource interface, so the plugin author can
        add arbitrary additional configuration to their data source. -->
        <property key="TestKeyGlobal1" value="TestValueGlobal1"/>
        <property key="TestKeyGlobal2" value="TestValueGlobal2"/>
    </global>
    <!-- The enclosing element for one or more datasource definitions. -->
    <datasources>
        <!-- Configuration for a single data source. All the information annotated in this
        element will be available to the DataSource class.
        Attributes:
        id: This is the mandatory data source ID, as provided in the /DASDSN/DSN/SOURCE/@id attribute of the XML returned by the DAS dsn command.
        name: This is the mandatory data source name, as provided in the /DASDSN/DSN/SOURCE element of the XML returned by the DAS dsn command. It may or may not be same as the id.
        version: This is the optional data source version, as provided in the /DASDSN/DSN/SOURCE/@version attribute of the XML returned by the DAS dsn command.
        mapmaster: This is the mandatory data source version, as provided in the /DASDSN/DSN/MAPMASTER element of the XML returned by the DAS dsn command. For a reference server, this should echo its own URL.
        description: This is the optional data source description, as provided in the /DASDSN/DSN/DESCRIPTION element of the XML returned by the DAS dsn command. For a reference server, this should echo its own URL.
        description-href: This is the optional data source description href attribute, as provided in the /DASDSN/DSN/DESCRIPTION/@href attribute of the XML returned by the DAS dsn command. For a reference server, this should echo its own URL.
        -->
        <datasource id="dsnId1"
                    name="dsnName1"
                    version="0.1"
                    mapmaster="mapmaster1"
                    description="dsnDescription1"
                    description-href="http://dsnDescriptionHref1">
            <!-- The fully qualified class name of the DataSource. -->
            <class>fully.qualified.class.1</class>
            <!-- The optional name of the DAS stylesheet to be used for this datasource.
            This will override the default stylesheet defined in the global settings section. -->
            <stylesheet>override_style</stylesheet>
            <!-- These properties are made available to the plugin class
            through the DataSource interface, so the plugin author can 
            add arbitrary additional configutation to their data source.-->
            <dna-command-enabled>true</dna-command-enabled>
            <features-strictly-enclosed>true</features-strictly-enclosed>
            <use-feature-id-for-feature-label>true</use-feature-id-for-feature-label>
            <include-types-with-zero-count>true</include-types-with-zero-count>
            <property key="dsn1key1" value="dsn1value1"/>
            <property key="dsn1key2" value="dsn1value2"/>
        </datasource>
        <datasource id="dsnId2"
                    name="dsnName2"
                    version="0.2"
                    mapmaster="mapmaster2"
                    description="dsnDescription2"
                    description-href="http://dsnDescriptionHref2">
            <class>fully.qualified.class.2</class>
            <dna-command-enabled>false</dna-command-enabled>
            <features-strictly-enclosed>false</features-strictly-enclosed>
            <use-feature-id-for-feature-label>false</use-feature-id-for-feature-label>
            <include-types-with-zero-count>false</include-types-with-zero-count>
        </datasource>
    </datasources>
</mydasserver>

